MCQ,Choices,Correct
What is generative artificial intelligence capable of generating?,"a: Text, images, videos, or other data | b: Only text | c: Only images | d: Only videos",a
What enabled an AI boom of generative AI systems in the early 2020s?,a: Improvements in transformer-based deep neural networks | b: Use of traditional algorithms | c: Lack of funding | d: Decrease in AI research,a
Which company is known for developing chatbots like ChatGPT and Copilot?,a: Apple | b: OpenAI | c: Amazon | d: Facebook,b
What are some of the industries where generative AI has uses?,"a: Healthcare, finance, entertainment | b: Only healthcare | c: Only finance | d: Only entertainment",a
What are some concerns raised about the potential misuse of generative AI?,"a: Cybercrime, use of fake news or deepfakes | b: Only cybercrime | c: Only use of fake news | d: Only deepfakes",a
